[
  {
    "id": "settlers",
    "name": "Settlers",
    "residents": { "floor": 2, "max": 8 },
    "tax_per_resident_per_min": 0.2,
    "house": "house_settlers",
    "unlock": { "population": {}, "buildings": [] }
  },
  {
    "id": "citizens",
    "name": "Citizens",
    "residents": { "floor": 5, "max": 15 },
    "tax_per_resident_per_min": 0.48,
    "house": "house_citizens",
    "unlock": {
      "population": { "settlers": 10 },
      "buildings": ["market_small"]
    }
  },
  {
    "id": "merchants",
    "name": "Merchants",
    "residents": { "floor": 9, "max": 25 },
    "tax_per_resident_per_min": 1.2,
    "unlock": {
      "population": { "citizens": 30 },
      "buildings": []
    }
  }
]
